114,DP 0153 - Spatial Dynamics of Labor Markets in Brazil,"Kenneth M. Chomitz, Daniel da Mata, Alexandre Carvalho e João Carlos Magalhães","ipea, economia, governo, federal, brasil, desenvolvimento, instituto de pesquisa econômica aplicada, secretaria de assuntos estratégicos, sae, pesquisa","There was substantial spatial variation in labor market outcomes in Brazil over the 1990’s. In 2000, about one fifth of workers lived in apparently economically stagnant municipios where real wages declined but employment increased faster than the national population growth rate. More than one third lived in apparently dynamic municipios experiencing both real wage growth and faster-than-average employment growth; these areas absorbed more than half of net employment growth over the period. To elucidate this spatial variation, we estimated spatial labor supply and demand equations describing wage and employment changes of Brazilian municípios. We used Conley’s spatial GMM technique to allow for instrumental variable estimation in the presence of spatially autocorrelated errors. Chief findings include: a very strong influence of initial workforce educational levels on subsequent wage growth (controlling for possibly confounding variables such as remoteness and climate); evidence of positive spillover effects of own-municipio growth onto neighbors’ wage and employment levels; an exodus from farming areas; relatively elastic response of wages to an increase in labor supply; and evidence of a local multiplier effect from government transfers.


O mercado de trabalho brasileiro apresentou uma dinâmica espacial diversa durante a década de 1990. Em 2000, aproximadamente um quinto dos trabalhadores vivia em municípios aparentemente estagnados em termos econômicos, em que os salários reais caíam, mas em que o emprego crescia acima da taxa de crescimento populacional do Brasil. Por outro lado, mais de um terço dos trabalhadores vivia em municípios dinâmicos, com crescimento dos salários reais e crescimento do emprego acima do crescimento populacional brasileiro: essas áreas absorveram mais da metade do crescimento líquido do emprego durante o período. A fim de elucidar essa dinâmica, o presente artigo estimou um modelo espacial de demanda e oferta por trabalho no qual descreve as mudanças no nível de salários e empregos dos municípios. Foi utilizado o método GMM espacial desenvolvido por Conley (1999),
que permite o uso de variáveis instrumentais na presença de autocorrelação espacial. Os principais resultados incluem: a influência muito forte do nível educacional inicial da força de trabalho na taxa de crescimento subseqüente dos salários (mesmo após controlar por diversas variáveis, tais como distância e clima); presença de efeitos de transbordamento positivos do crescimento do município sobre os níveis de salário e emprego de seus vizinhos; queda no emprego em atividades rurais; elasticidade na resposta dos salários a um aumento na oferta de trabalho; e presença de efeitos multiplicadores das transferências governamentais.",https://portalantigo.ipea.gov.br/portal/images/stories/PDFs/TDs/ingles/dp_153.pdf,,https://portalantigo.ipea.gov.br/portal/index.php?option=com_content&view=article&id=24691
115,DP 0152 - Can Macroeconomic Variables Account for the Term Structure of Sovereign Spreads? Studying the Brazilian Case,Marco Matsumura e Ajax R. B. Moreira,"ipea, economia, governo, federal, brasil, desenvolvimento, instituto de pesquisa econômica aplicada, secretaria de assuntos estratégicos, sae, pesquisa","The objective of our work is to study the term structure of interest rates and the sovereign credit spreads of emerging markets. We develop a model from term
structure, credit risk and vector autoregressive models, based on the articles by Ang and Piazzesi (2003) and Ang, Dong and Piazzesi (2005). Those article’s principal innovation is to include and study the relation among macroeconomic variables and state variables of conventional term structure models. Our contributions include simplifying their model, propose a new estimation method, add credit risk, and show results for Brazilian domestic and external markets.


Nosso trabalho objetiva estudar a estrutura a termo de juros e o risco de crédito soberano de países emergentes. Para isso desenvolvemos um modelo a partir de modelos de estrutura a termo, de risco de crédito e de vetores auto-regressivos, baseados nos trabalhos de Ang e Piazzesi (2003) e Ang, Dong e Piazzesi (2005). A principal inovação desses artigos é incluir e estudar a relação entre variáveis macroeconômicas e de estado dos modelos de estrutura a termo convencionais. Nossas contribuições incluem simplificar o modelo proposto por eles, propor um novo método de estimação, adicionar risco de crédito e obter resultados para os mercados doméstico e externo do Brasil.",https://portalantigo.ipea.gov.br/portal/images/stories/PDFs/TDs/ingles/dp_152.pdf,,https://portalantigo.ipea.gov.br/portal/index.php?option=com_content&view=article&id=24692
116,"DP 0151 - Socioeconomic Structure, Self-fulfilment, Homicides and Spatial Dependence in Brazil","Alexandre Carvalho, Daniel Cerqueira e Waldir Lobão","ipea, economia, governo, federal, brasil, desenvolvimento, instituto de pesquisa econômica aplicada, secretaria de assuntos estratégicos, sae, pesquisa","In this article we develop a theoretical model to explain the homicide rate in any given place and construct a Bayesian model with a spatial structure to test the hypotheses. We assume that in his quest for self-fulfilment the individual, when taking the decision to perpetrate violence, not only responds to expected economic costs and benefits, but also to an internal system of reward and punishment, synthesized by the emotions. Symbolic valuation, in particular, with respect to conventional rules and the subjective valuation of life itself, depends on socioeconomic and age-group bonds. Theoretical conclusions show that the probability of victimization by violence is higher in places with greater income inequality, larger proportion of youths in the population and socioeconomic vulnerability. The model tested covered 5.507 Brazilian municipalities from 1999 to 2001, and we calculated the risk of a resident in any given municipality being a victim of homicide. This variable was confronted with other structural variables in order to obtain homicide elasticities and the effect of spatial dependency in explaining the risk of local victimization. The results suggest that there is evidence to support the theoretical propositions.


Neste estudo, desenvolvemos um modelo teórico para explicar a taxa de homicídios em uma determinada localidade e estimamos, através de métodos bayesianos, um modelo econométrico com estrutura espacial para testar as hipóteses. Admitimos que, na busca pela auto-realização, ao tomar a decisão por perpetrar a violência, o indivíduo responde não apenas a benefícios e custos econômicos esperados, mas a um sistema interno de premiação e punição, sintetizado pelas emoções. A valoração simbólica, em particular, no que diz respeito às normas estabelecidas e à valoração subjetiva da vida dependem dos laços de ligação socioeconômica e da faixa etária. As conclusões teóricas revelam que em localidades onde há maior desigualdade da renda, maior proporção de jovens na população e maior vulnerabilidade socioeconômica, maior deveria ser a probabilidade de vitimização por homicídio. Procuramos evidências das proposições teóricas com base em um modelo estatístico regressivoauto-regressivo espacial misto, cujas informações cobriram 5.507 municípios brasileiros para os anos de 1999 a 2001. Calculamos o risco de um indivíduo residente em tal município sofrer homicídio e confrontamos essa variável com um conjunto de variáveis socioeconômicas estruturais, de modo a se obterem as elasticidades da taxa de homicídios e o efeito que a dependência espacial exerce para explicar o risco de vitimização local. Os resultados sugeriram haver evidências das proposições teóricas.",https://portalantigo.ipea.gov.br/portal/images/stories/PDFs/TDs/ingles/dp_151.pdf,,https://portalantigo.ipea.gov.br/portal/index.php?option=com_content&view=article&id=24694
117,DP 0150 - Agricultural Growth in Brazil in the Period 1999-2004: Outburst of Soybeans and Livestock and its Impact on the Environment,"Antonio Salazar Pessoa Brandão, Gervásio Castro de Rezende e Roberta Wanderley da Costa Marques","ipea, economia, governo, federal, brasil, desenvolvimento, instituto de pesquisa econômica aplicada, secretaria de assuntos estratégicos, sae, pesquisa","This paper analyses the Brazilian agricultural growth since January 1999, when a new exchange rate policy was adopted by the country. The analysis focuses on the behavior of the exchange rate and international commodity prices throughout the period 1999-2004. It is also analysed the behavior of cropped area in this recent period, with the conclusion that there has been a fast increase in area planted with grains in the agricultural years 2001/2002, 2002/2003 and 2003/2004, due almost entirely to the growth of soybeans area. The paper proposes that this expansion of area planted with soybeans was based preponderantly on the conversion of pastures. It is also suggested that expansion of soybeans should not be seen as antagonistic to the environmental policy, specially in what respects the protection of the Amazon forest.


Este trabalho analisa o crescimento agrícola brasileiro após a mudança da política cambial, em janeiro de 1999. Toma como base, para isso, o comportamento da taxa de câmbio e dos preços internacionais das commodities ao longo do período 1999-2004. Discute, também, o comportamento da área cultivada nesse período recente, mostrando que ocorreu um aumento muito grande da área plantada com grãos nos anos agrícolas 2001/2002, 2002/2003 e 2003/2004, em grande parte devido à expansão da soja. O trabalho propõe que essa expansão tão rápida da área plantada com soja deu-se preponderantemente com base em conversão de pastagens. Sugere, ainda, que a expansão da soja não deve ser vista como antagônica à política ambiental, especialmente no que se refere à proteção da floresta amazônica.",https://portalantigo.ipea.gov.br/portal/images/stories/PDFs/TDs/ingles/dp_150.pdf,,https://portalantigo.ipea.gov.br/portal/index.php?option=com_content&view=article&id=24695
118,"DP 0149 - Monetary Policy, Inflation and the Level of Economic Activity in Brasil after the Real Plan: Stylized Facts from SVAR Models","Brisne J. V. Céspedes, Elcyon C. R. Lima e Alexis Maka","ipea, economia, governo, federal, brasil, desenvolvimento, instituto de pesquisa econômica aplicada, secretaria de assuntos estratégicos, sae, pesquisa","This article investigates the stochastic and dynamic relationship of a group of Brazilian macroeconomic variables (price and industrial production indexes, nominal exchange rate, short and medium-run nominal interest rates) for the period after the Real Plan (1996-2004). We adopt, as has become usual in the literature, several SVAR (structural VAR) models to uncover stylized facts for the short-run impacts of the identified exogenous sources of fluctuations of this selected set of variables. A distinctive feature of this article is the employment of Directed Acyclic Graphs (DAG) to obtain the contemporaneous causal order of the variables used to identify the SVAR models. Another distinguishing characteristic is the careful attention paid to monetary policy developments after the Real Plan when splitting our sample in two subsamples (1996/07-1998/08 and 1999/03-2004/12). The main results are: a) in response to a positive short run interest rate innovation, during the 1999-2004 subperiod, the output and the price level decrease—however, the output response is faster and the price level responds with a lag of near four months; b) for the 1996-1998 subperiod, the most likely effect of a positive short run interest rate innovation is the reduction of the price level (also with a four months lag), even though there is a large uncertainty in this response, and the reduction of output; c)short run interest rate innovations are one of the most important sources of temporary fluctuations in the level of economic activity for both subsamples; and d) exogenous shocks to the exchange rate and to the medium term interest rate are for the 1999-2004 period, the most important sources of inflation rate fluctuation.


Este artigo investiga as relações estocásticas e dinâmicas de um grupo de variáveis macroeconômicas brasileiras (índices de preços, produção industrial, taxa de câmbio nominal, taxas de juros de curto e médio prazo, e M1) para o período após o Plano Real (1996-2004). Adota, como é usual na literatura, vários modelos SVARs (VAR estruturais) para determinar os fatos estilizados relativos aos impactos de curto prazo das fontes exógenas de flutuação identificadas para esse grupo de variáveis. O artigo inova ao empregar Grafos Acíclicos Direcionados (DAG) na obtenção das relações causais contemporâneas entre as variáveis e ao considerar que as alterações da política monetária, ocorridas após o Plano Real, tornam essencial a divisão da nossa amostra em dois subperíodos (1996/07-1998/08 e 1999/03-2004/12). Os resultados principais são: a) em resposta a uma inovação positiva na taxa de juros de curto prazo (Selic), durante o subperíodo 1999-2004, a produção e o nível de preços caem — porém, a resposta da produção é mais rápida que a do nível de preços, que só acontece com uma defasagem de aproximadamente quatro meses; b) para o período 1996-1998, o efeito mais provável de uma inovação positiva na taxa de juros de curto prazo é a redução do nível de preços  também com uma defasagem de quatro meses, embora haja uma grande incerteza em relação a essa resposta  e da produção; c) as inovações na taxa de juros de curto prazo (Selic) estão entre as fontes mais importantes da flutuação do nível de atividade econômica em ambos os subperíodos; e d) os choques exógenos na taxa de câmbio e na taxa de juros de médio prazo (Swap Pré x CDI) são, para o período 1999-2004, as fontes mais importantes da flutuação da taxa de inflação.",https://portalantigo.ipea.gov.br/portal/images/stories/PDFs/TDs/ingles/dp_149.pdf,,https://portalantigo.ipea.gov.br/portal/index.php?option=com_content&view=article&id=24697
119,DP 0148 - Analysis of Emerging Markets Sovereign Credit Spreads,Marco S. Matsumura,"ipea, economia, governo, federal, brasil, desenvolvimento, instituto de pesquisa econômica aplicada, secretaria de assuntos estratégicos, sae, pesquisa","Our objective is to implement a credit risk pricing model for sovereign bonds and estimate the model for a historical series of yields of emerging markets bonds. We use a reduced model with a Vasicek 2-factor model on Brazilian sovereign data. The estimation occurs in two stages. Using Maximum Likelihood, we first estimate the parameters corresponding to the reference curve. Then, we find the estimates of the set of parameters corresponding to the defaultable curve conditional on the default- free parameters. The estimated model is used to calculate the dynamics of the term structure of interest rates, of credit spreads and of default probabilities.


Nosso objetivo é implementar um modelo de apreçamento de títulos soberanos sujeitos a defaut e estimulá-lo usando uma série histórica de títulos de mercados emergentes. Usamos um modelo reduzido com uma dinâmica Vasicek 2-fatores sobre dados soberanos brasileiros. A estimação ocorre em duas etapas. Usando Máxima Verossimilhança, primeiro estimamos os parâmetros correspondentes à curva de referência. Em seguida, encontramos as estimativas do conjunto de parâmetros correspondentes à curva do título sujeito a default condicionado aos parâmetros da curva livre de default. O modelo estimado é usado para calcular a dinâmica da estrutura a termo de taxa de juros, de spreads de crédito e de probabilidade de default.",https://portalantigo.ipea.gov.br/portal/images/stories/PDFs/TDs/ingles/dp_148.pdf,,https://portalantigo.ipea.gov.br/portal/index.php?option=com_content&view=article&id=24708
120,DP 0147 - Estimating Potential Output: a Survey of the Alternative Methods and their Applications to Brazil,Nelson H. Barbosa Filho,"ipea, economia, governo, federal, brasil, desenvolvimento, instituto de pesquisa econômica aplicada, secretaria de assuntos estratégicos, sae, pesquisa","This paper presents the main issues involved in estimating potential output. The objective is to describe the alternative methods and analyze their application and implications for growth forecasts and macroeconomic policy in Brazil. The text emphasizes the determinants of potential output under fixed and flexible coefficients of production. Given the wide use of aggregate measures of Total Factor Productivity in growth accounting, and the sensitivity of such a variable to economic assumptions and errors of measurement, the text also presents the main applied critiques and alternatives to aggregate growth-accounting exercises. The main conclusions are: i) the annual potential growth rate of Brazil’s Gross Domestic Product (GDP) varies substantially depending on the method and hypotheses adopted and, what is most important, potential GDP is not separable from effective GDP in the long-run; ii) growth-accounting and time-series studies of Brazil result in low potential-output growth rates because they extrapolate the slow growth of 1981-2003 to the future; iii) capital seems to be the main constraint on growth in Brazil and, therefore, a demand-led increase in investment can raise both its effective and potential output levels; iv) however, because of the slow adjustment of the capital stock, an investment boom can also hit a supply constraint before the stock of capital has time to adjust to the growth rate of investment; and v) aggregate measures of potential output do not carry much information about the economy and, therefore, they should be complemented by sectoral estimates of capacity utilization to identify the bottlenecks in inter-industry flows and the corresponding demand pressures on inflation.",https://portalantigo.ipea.gov.br/portal/images/stories/PDFs/TDs/ingles/dp_147.pdf,,https://portalantigo.ipea.gov.br/portal/index.php?option=com_content&view=article&id=24709
121,DP 0146 - The Housing Conditions in Brazilian Urban Areas during the 1990s,Maria da Piedade Morais,"ipea, economia, governo, federal, brasil, desenvolvimento, instituto de pesquisa econômica aplicada, secretaria de assuntos estratégicos, sae, pesquisa","The objective of this article is to characterize the housing conditions in Brazilian urban areas during the 1990s, based upon housing and urban indicators derived from the 1992-1999 IBGE National Household Surveys (PNAD) microdata. The paper intends to be useful as a first attempt to systematize and analyze the available information on housing in Brazil, as a cornerstone to discuss the major trends and problems of the Brazilian housing sector, in order to subsidize the formulation of public policies and programs of housing and urban development. Section 2 discusses the main characteristics of housing that justify governmental intervention in housing markets. Section 3 depicts the housing conditions in Brazilian urban areas, emphasizing the housing situation of the poor and other vulnerable groups. Section 4 analyzes the main housing problems in Brazil, such as slums formation, tenure insecurity and housing and urban infrastructure deficits. Finally, section 5 presents the conclusions and suggestions for a future research agenda on housing in Brazil, urging for better targeting and integration between the housing policy and the macroeconomic and other sectorial and social policies of the government, at the federal, state and local levels.


O objetivo deste trabalho é caracterizar as condições de moradia nas áreas urbanas brasileiras durante a década de 1990, com base em indicadores habitacionais e de desenvolvimento urbano construídos a partir dos microdados da Pesquisa Nacional por Amostra de Domicílios (Pnad) do Instituto Brasileiro de Geografia e Estatística (IBGE) para o período 1992-1999. Este texto pretende ser útil como um primeiro esforço de sistematização da informação existente no que diz respeito à habitação no Brasil, como ponto de partida para discutir as tendências e os principais problemas do setor habitacional, com vistas a fornecer subsídios para a formulação de políticas e programas nas áreas de habitação e de desenvolvimento urbano. A seção 2 discute as principais características do bem habitação que justificam a intervenção do governo nos mercados habitacionais. A seção 3 mostra as condições de habitação nas áreas urbanas brasileiras, destacando as condições de moradia dos pobres e de outros grupos vulneráveis. A seção 4 analisa os principais problemas habitacionais brasileiros, tais como formação de favelas, informalidade da habitação, falta de segurança na posse e déficits de habitação e de serviços urbanos, entre outros. Finalmente, a seção 5 apresenta as principais conclusões e sugestões para uma futura agenda de pesquisa em Habitação no Brasil, mostrando a necessidade de uma melhor focalização e integração entre as políticas habitacionais, macroeconômicas e outras políticas setoriais e sociais do governo no nível federal, no estadual e no municipal.",https://portalantigo.ipea.gov.br/portal/images/stories/PDFs/TDs/ingles/dp_146.pdf,,https://portalantigo.ipea.gov.br/portal/index.php?option=com_content&view=article&id=24710
122,DP 0145 - Affordable Housing Needs Assessment Methodology: The Adaptation of the Florida Model to Brazil,"Mozart Vitor Serra, William J. O’Dell, Joseli Macedo, Marc T. Smith, Maria da Piedade Morais, Santiago F. Varella e Diep Nguyen","ipea, economia, governo, federal, brasil, desenvolvimento, instituto de pesquisa econômica aplicada, secretaria de assuntos estratégicos, sae, pesquisa","This paper presents the adaptation of the “Florida Affordable Housing Needs Assessment Methodology” (Noll et al., 1997) to Brazil. This was a task developed jointly by the Florida team with researchers from IPEA and the World Bank. The Affordable Housing Needs Assessment Methodology, developed by the Shimberg Center for Affordable Housing for the State of Florida, is based on household estimates calculated from household formation rates and population-by-age projections. The Brazilian Model was developed for four regions: the country of Brazil as a whole, the Integrated Development Region of the Federal District (RIDE of DF), and the Metropolitan Regions of Recife and Curitiba. This paper describes the adaptation process, presents the newly developed Brazilian Affordable Housing Needs Assessment and analyzes output from the model.


Este trabalho apresenta a adaptação da “Metodologia de Avaliação das Necessidades de Habitação Popular da Florida” para o caso brasileiro (Noll et al., 1997). Esta foi uma tarefa desenvolvida conjuntamente pela equipe da Universidade da Florida com pesquisadores do IPEA e do Banco Mundial. A “Metodologia de Avaliação das Necessidades de Habitação Popular”, desenvolvido pelo Shimberg Center for Affordable Housing para o Estado da Florida, baseia-se em estimativas de unidades familiares calculadas a partir da taxa de formação de famílias e projeções da população por faixa etária. O Modelo Brasileiro foi desenvolvido para quatro regiões: i) o país como um todo; ii) a Região Integrada de Desenvolvimento do Distrito Federal e o Entorno (RIDE do DF); iii) a Região Metropolitana do Recife; e iv) a Região Metropolitana de Curitiba. Este texto descreve o processo de adaptação, apresenta o Novo Modelo de Necessidades de Habitação Popular desenvolvido para o Brasil e analisa os resultados desse modelo.",https://portalantigo.ipea.gov.br/portal/images/stories/PDFs/TDs/ingles/dp_145.pdf,,https://portalantigo.ipea.gov.br/portal/index.php?option=com_content&view=article&id=24712
