158,DP 0109 - Reducing Schooling Inequality in Brazil: Demographic Opportunities and Inter-cohort Differentials,"Carlos Eduardo Velez, Sergei Soares and Marcelo Medeiros","ipea, economia, governo, federal, brasil, desenvolvimento, instituto de pesquisa econômica aplicada, secretaria de assuntos estratégicos, sae, pesquisa","The objective of this paper is to explore the interplay between schooling and demographics in Brazil. We would like to provide a preliminary answer to the question of how long will improvements in schooling of younger cohorts take o change the distribution of educational endowments of the total labor force. This answer depends on two factors. The first is the demographic composition of the working age population — the weight each cohort has in the 16 to 70 year old population. The second is the distribution of schooling within each cohort — its average educational level and the inequality within each cohort. These two factors — demography and education by cohort — define the average educational level and the distribution of education for the working age population in any given year. This paper takes a standard demographic projection and makes various hypotheses about the evolution of education — both the mean and inequality. According to these hypotheses, we will calculate how long improvements in the schooling of successive cohorts take to translate into significant improvements in the schooling of the working age population. Our results are somewhat pessimistic. We calculate that even very strong departures from the observed trend will take many years or decades to translate into significantly different educational endowments for the working age population. In other words, we show that demographic inertia is a strong factor preventing changes in educational endowments in periods shorter than a few decades.
O objetivo deste trabalho é a exploração das relações entre escolaridade e demografia no Brasil. Gostaríamos de apresentar uma investigação preliminar sobre quanto tempo melhorias no sistema educacional vão demorar para se refletir na distribuição educacional da população em idade ativa (PIA). Este tempo de resposta depende de dois fatores. O primeiro é a composição etária da população em idade ativa — o peso de cada coorte na população de 16 a 70 anos. O segundo fator é a distribuição da instrução formal dentro de cada coorte — a média e a desigualdade de anos de estudo completados com sucesso. Estes dois fatores — demografia e educação por coorte — definem tanto o nível educacional médio como a distribuição da educação dentro da PIA para um ano qualquer. Neste texto, usamos uma projeção demográfica padrão e fazemos várias hipóteses sobre a evolução tanto da média como da desigualdade educacional. De acordo com essas hipóteses, é possível calcular quanto tempo melhorias no nível educacional de coortes sucessivas vão levar para se traduzir em melhorias significativas na distribuição da escolaridade da PIA. Os resultados, infelizmente, são um tanto pessimistas. Calculamos que até melhorias fortes com relação à tendência observada vão demorar anos ou até décadas para se transformar em dotações educacionais significativamente maiores e melhor distribuídas para a PIA. Em outras palavras, a inércia demográfica é um fator forte impedindo transformações dramáticas na distribuição da educação em períodos menores que algumas poucas décadas.",https://portalantigo.ipea.gov.br/portal/images/stories/PDFs/TDs/ingles/dp_109.pdf,,https://portalantigo.ipea.gov.br/portal/index.php?option=com_content&view=article&id=24806
159,"DP 0108 - the Impacts of the Minimum Wage on the Labor Market, Poverty and Fiscal Budget in Brazil","Miguel N. Foguel, Lauro Ramos and Francisco Carneiro","ipea, economia, governo, federal, brasil, desenvolvimento, instituto de pesquisa econômica aplicada, secretaria de assuntos estratégicos, sae, pesquisa","This paper aims at contributing to the debate regarding the role of the minimum wage in Brazil. This is carried out by assessing its potential effects on the labor market outcomes, as well in terms of poverty alleviation and fiscal impact. First, a succinct description of the institutional framework, the evolution of its real value over time, and a characterization of the profile of minimum wage earners are presented. Next, after a brief survey of theoretical views and empirical results found in the literature, the estimations, as well their implications in terms of minimum wage policies, are presented and discussed.

Este trabalho procura contribuir para a discussão a respeito do papel do salário mínimo no Brasil, avaliando os efeitos potenciais de políticas de salário mínimo nos grandes agregados do mercado de trabalho, assim como sobre a incidência de pobreza e seu impacto fiscal. A primeira parte descreve, de forma sucinta, o histórico institucional do salário mínimo desde sua criação, a evolução do seu valor real ao longo deste período, além de fornecer a caracterização do perfil dos indivíduos que o recebem. A seguir, após uma rápida apresentação das diferentes visões acerca do seu papel no plano teórico e uma revisão dos resultados encontrados no plano empírico, procede-se às estimações de seu impacto no emprego, salários, pobreza e equilíbrio fiscal.",https://portalantigo.ipea.gov.br/portal/images/stories/PDFs/TDs/ingles/dp_108.pdf,,https://portalantigo.ipea.gov.br/portal/index.php?option=com_content&view=article&id=24810
160,DP 0106 - Explaining Agriculture Expansion and Deforestation: Evidence from the Brazilian Amazon – 1980/98,Claudio Ferraz,"ipea, economia, governo, federal, brasil, desenvolvimento, instituto de pesquisa econômica aplicada, secretaria de assuntos estratégicos, sae, pesquisa","The extent of deforestation in the Brazilian Amazon grew significantly in the last 20 years. Approximately 400,000 km2 of tropical forest were cleared from 1978 to 1998. Land conversion to pasture and crop areas were the main sources of deforestation, though the contribution of logging increased significantly in the nineties. This paper uses panel data for eight states of the Brazilian Amazon, from 1980 to 1998, to estimate a model of the determinants of crop area and cattle herd expansion within the region. Results show that the expansion of crop area is determined by changes in land prices, government agriculture credit and roads while the growth of cattle herd is mainly driven by the decrease in the price of cattle head and the expansion of the road network.

O desflorestamento na Amazônia aumentou significativamente durante os últimos 20 anos. Aproximadamente 400.000 km2 de florestas tropicais foram devastados entre 1978 e 1998, sendo a sua maioria convertida em pastagens e lavouras. Este trabalho usa dados de painel de oito estados da Amazônia, de 1980 a 1998, para estimar um modelo dos determinantes da expansão da área plantada e de cabeças de gado na região. Os resultados mostram que a expansão da área plantada está associada a variações de preços da terra, crédito agrícola e estradas, enquanto o aumento do número de cabeças de gado está determinado principalmente pela redução do preço do boi e pela expansão da malha rodoviária.",https://portalantigo.ipea.gov.br/portal/images/stories/PDFs/TDs/ingles/dp_106.pdf,,https://portalantigo.ipea.gov.br/portal/index.php?option=com_content&view=article&id=24852
161,DP 0105 - Bayesian Analysis of Econometric Time Series Models Using Hybrid Integration Rules,Ajax R. B. Moreira and Dani Gamerman,"ipea, economia, governo, federal, brasil, desenvolvimento, instituto de pesquisa econômica aplicada, secretaria de assuntos estratégicos, sae, pesquisa","This paper is concerned with the study of Bayesian inference procedures to commonly used time series models. In particular, the dynamic or state-space models, the time-varying vector autoregressive model and the structural vector autoregressive model are considered in detail. Inference procedures are based on a hybrid integration scheme where state parameters are analytically integrated and hyperparameters are integrated by Markov chain Monte Carlo methods. Credibility regions for forecasts and impulse responses are then derived. The procedures are illustrated in real data sets.

Este artigo utiliza procedimentos de inferência bayesiana para estimar modelos econométricos freqüentemente usados. Em particular, os modelos dinâmicos ou de espaço de estado são considerados detalhadamente. Procedimentos de inferência baseiam-se em esquemas de integração híbridos, em que as variáveis de estado são integradas analiticamente, e os hiperparâmetros são integrados utilizando o método de cadeias de Markov de Monte Carlo. As regiões de credibilidade da previsão e das funções de resposta a impulso são também avaliadas. Os procedimentos são ilustrados com dados reais da economia brasileira.",https://portalantigo.ipea.gov.br/portal/images/stories/PDFs/TDs/ingles/dp_105.pdf,,https://portalantigo.ipea.gov.br/portal/index.php?option=com_content&view=article&id=24853
162,DP 0104 - Core Inflation: Robust Common Trend Model Forecasting,Ajax R. B. Moreira and Hélio S. Migon,"Core in°ation, Robust Kalman Filter, Common Trend, In°uence function.","The monetary authorities need a future measure of in°ation trend to keep on tracking the in°ation on target. Many alternatives of the core in°ation measure have appeared in the recent literature pretending to avoid the de¯ciencies of the usual headline in°ation index as a predictor. This price index is de¯ned as some weighted average of the individual price change of a list of goods and services. To use it as the future in°ation indicator is criticized in the literature, as far as the products are heterogeneous in respect to the variability and some of the involved prices have relevant seasonal movements. A multivariate model including simultaneously the seasonal e®ects of each component of the price index and a common trend - the core in°ation - will be developed in this paper. The model will be phrased as a dynamic model and a robust sequential ¯lter will be introduced. The posterior and predictive distributions of the quantities of interest will be evaluated via stochastic simulation techniques, MCMC - Monte Carlo Markov Chain. Di®erent models will be compared using the minimum posterior predictive loss approach and many graphical illustrations will be presented.
Keywords: Core in°ation, Robust Kalman Filter, Common Trend, In°uence function.

As autoridades monetárias necessitam de uma previsão da tendência futura da inflação para agir preventivamente sobre a economia. Na literatura encontram-se muitas propostas para o núcleo da inflação que evitam algumas das deficiências do índice de preços usual como um previsor da inflação futura. O índice de preços é definido como uma soma ponderada das taxas de variação de preços de uma lista de bens e serviços. A utilização desse índice como um indicador da inflação futura é criticada na literatura porque a variabilidade de preços dos produtos é heterogênea, e alguns dos preços apresentam componente sazonal relevante. Este artigo propõe um modelo multivariado que descreve os movimentos dos preços dos produtos com uma componente comum, e componentes sazonais e irregulares definidas para cada elemento da lista de bens e serviços do índice de preços. É um modelo dinâmico que utiliza um filtro seqüencial robusto. As distribuições preditivas a posteriori das quantidades de interesse serão avaliadas utilizando a técnica estocástica do Monte Carlo Markov Chain (MCMC). Os diferentes modelos serão comparados utilizando como critério minimizar a variância preditiva.",https://portalantigo.ipea.gov.br/portal/images/stories/PDFs/TDs/ingles/dp_104.pdf,,https://portalantigo.ipea.gov.br/portal/index.php?option=com_content&view=article&id=24854
163,DP 0103 - Measuring the Tax effort of Developed and Developing Countries. Cross Country – Panel Data Analysis – 1985/95,Marcelo Piancastelli,"ipea, economia, governo, federal, brasil, desenvolvimento, instituto de pesquisa econômica aplicada, secretaria de assuntos estratégicos, sae, pesquisa","Os resultados deste trabalho sugerem que o nível de renda per capita, a razão entre volume de comércio e PIB e a participação relativa do setor agrícola no PIB são os elementos mais significativos na determinação da razão entre receita tributária e PIB. Por outro lado, variáveis usualmente utilizadas em outros trabalhos, tais como relação entre o produto da indústria extrativa mineral e o PIB, relação entre quase-moeda (M3) e PIB deixaram de ter relevância como elementos explicativos da carga tributária. O trabalho mostra os países que melhoraram sua performance fiscal, medida pelo índice de esforço fiscal, bem como aqueles com performance menos favorável. Índices de esforço fiscal são, em seguida, comparados entre grupos de países de alta, média e baixa renda bem como entre diferentes continentes.

Na literatura sobre tributação, o índice de esforço fiscal de um país é medido pela razão entre a carga tributária realizada e a carga tributária prevista, sendo a carga tributária medida pela relação receita realizada/prevista sobre o produto interno bruto (PIB). Este índice reflete a variância da capacidade tributária de um determinado país. Um elevado índice de esforço fiscal revela que um país, em particular, está arrecadando mais receita tributária que o previsto, tendo-se em conta a sua estrutura tributária vigente e as condições estruturais prevalecentes, tanto econômicas quanto sociais. Este trabalho estima o índice de esforço fiscal para uma amostra de 75 países no período 1985/95. Dados disponíveis mais recentes e método econométrico até então nunca utilizado nesse tipo de análise foram utilizados. Os resultados obtidos foram então comparados com trabalhos anteriores existentes e que cobrem diferentes períodos nos últimos 30 anos.",https://portalantigo.ipea.gov.br/portal/images/stories/PDFs/TDs/ingles/dp_103.pdf,,https://portalantigo.ipea.gov.br/portal/index.php?option=com_content&view=article&id=24855
164,DP 0102 - Space-varying Regression Models: Specifications and Simulation,"Dani Gamerman,  Ajax R. B. Moreira and Havard Rue",Bayesian;  Hyperparameters; Gibbs  sampling;  Markov  chain  Monte Carlo; Markov random  fields; Metropolis-Hastings algorithm; Sampling schemes.,"Space-varying regression  models are  generalizations of standard linear models where  the  regression  coefficients are  allowed  to change  in space.   The  spatial structure is  specified  by  a  multivariate  extension   of pairwise  difference  pri- ors thus enabling incorporation of neighboring  structures and easy sampling schemes.    Different  sampling  schemes  are  available   and  may  be  used  in  an MCMC  algorithm.   These  schemes  are  compared   in  terms  of chain  autocor- relation  and  resulting  inference.   We also discuss  different  prior  specifications that accommodate the spatial  structure. Results  are illustrated with simulated data  and applied  to a real dataset.
Key  words:  Bayesian;  Hyperparameters; Gibbs  sampling;  Markov  chain  Monte Carlo; Markov random  fields; Metropolis-Hastings algorithm; Sampling schemes.

Os modelos de regressão com parâmetros variando no espaço são uma generalização dos modelos lineares em que é permitido aos coeficientes da regressão mudarem ao longo do espaço. A estrutura espacial é especificada por uma extensão multivariada de uma distribuição a priori que considera as diferenças entre os coeficientes de regiões vizinhas. Isso permite a incorporação da informação da vizinhança espacial. Para estimar o modelo utilizamos a abordagem bayesiana e o algoritmo do MCMC considerando diferentes esquemas de amostragem. Esses esquemas foram comparados em termos da autocorrelação da cadeia de Markov, e em termos dos resultados obtidos. Foram discutidas diferentes especificações a priori que admitem estruturas espaciais semelhantes. Os resultados são ilustrados com dados simulados e com um conjunto real de informações.",https://portalantigo.ipea.gov.br/portal/images/stories/PDFs/TDs/ingles/dp_102.pdf,,https://portalantigo.ipea.gov.br/portal/index.php?option=com_content&view=article&id=24856
165,DP 0101 - Optimal Rules for Monetary Policy in Brazil,Joaquim Pinto de Andrade and José Angelo C. A. Divino,"ipea, economia, governo, federal, brasil, desenvolvimento, instituto de pesquisa econômica aplicada, secretaria de assuntos estratégicos, sae, pesquisa","This paper presents optimal rules for monetary policy in Brazil derived from a backward looking expectation model consisting of a Keynesian IS function and an Augmented Phillips Curve (IS-AS). The IS function displays a high sensitivity of aggregate demand to the real interest rate and the Phillips Curve is accelerationist. The optimal monetary rules show low interest rate volatility with reaction coefficients lower than the ones suggested by Taylor (1993a,b). Reaction functions estimated through ADL and SUR models suggest that monetary policy has not been optimal and has aimed to product rather than inflation stabilization.

Este trabalho apresenta regras ótimas de política monetária no Brasil derivadas de um modelo que consiste de uma função keinesiana IS e uma Curva de Phillips Aumentada (IS-AS) e com expectativas voltadas para trás. A função IS revela alta sensibilidade da demanda agregada à taxa de juros e a Curva de Phillips é aceleracionista. A regra ótima de política monetária mostra reduzida volatilidade da taxa de juros com coeficientes de reação menores do que os sugeridos por Taylor (1993a e b). Funções de reação estimadas através de modelos ADL e SUR sugerem que a política monetária não tem sido ótima e tem buscado estabilizar o produto em lugar da inflação.
",https://portalantigo.ipea.gov.br/portal/images/stories/PDFs/TDs/ingles/dp_101.pdf,,https://portalantigo.ipea.gov.br/portal/index.php?option=com_content&view=article&id=24857
166,DP 0100 - Robustness and Stabilization Properties of Monetary Policy Rules in Brazil,Ajax R. B. Moreira and Marco A. F. H. Cavalcanti,"ipea, economia, governo, federal, brasil, desenvolvimento, instituto de pesquisa econômica aplicada, secretaria de assuntos estratégicos, sae, pesquisa","Based on three versions of a small macroeconomic model for Brazil, this paper presents empirical evidence on the effects of parameter uncertainty on monetary policy rules and on the robustness of optimal and simple rules over different model specifications. By comparing the optimal policy rule under parameter uncertainty with the rule calculated under purely additive uncertainty, we find that parameter uncertainty should make policymakers react less aggressively to the economy’s state variables, as suggested by Brainard’s “conservatism principle”, although this effect seems to be relatively small. We then informally investigate each rule’s robustness by analyzing the performance of policy rules derived from each model under each one of the alternative models. We find that optimal rules derived from each model perform very poorly under alternative models, whereas a simple Taylor rule is relatively robust. We also find that even within a specific model, the Taylor rule may perform better than the optimal rule under particularly unfavorable realizations from the policymaker’s loss distribution function.

Este texto analisa a robustez e as propriedades de estabilização de regras de política monetária no contexto de um pequeno modelo macroeconométrico para o Brasil. Estimam-se três versões do modelo “padrão” da literatura recente sobre regras de política monetária. Em cada caso, a regra ótima de política é calculada sob incerteza puramente aditiva e sob incerteza multiplicativa. Observa-se que a incerteza sobre os parâmetros do modelo atenua os coeficientes da função de reação ótima das autoridades, conforme sugerido pelo “princípio do conservadorismo” de Brainard — ainda que esse efeito seja relativamente pequeno. A robustez das regras de política é investigada informalmente por intermédio da análise do desempenho da regra ótima de cada modelo no contexto de cada um dos modelos alternativos. Os resultados mostram que as regras ótimas derivadas de um modelo específico tendem a apresentar desempenho muito fraco sob os demais modelos, em contraste com uma regra de Taylor simples, que se revela relativamente robusta. Finalmente, mostra-se que, mesmo no contexto de um modelo específico, a regra de Taylor pode ter desempenho superior à regra ótima, sob realizações particularmente desfavoráveis da distribuição de probabilidade da função de perda das autoridades.",https://portalantigo.ipea.gov.br/portal/images/stories/PDFs/TDs/ingles/dp_100.pdf,,https://portalantigo.ipea.gov.br/portal/index.php?option=com_content&view=article&id=24858
167,DP 0099 - Estimation of the Brazilian Consumer Demand System,"Seki Asano, Ana Luiza N. H. Barbosa and Eduardo P. S. Fiuza","Consumer demand System, Almost Ideal Demand System, Brazilian family expenditures. Sistema de demanda de consumo, Almost Ideal Demand System, dispêndios das famílias brasileiras.","In this study we estimate the Brazilian consumer demand system through family expenditure data, which cover all consumption categories. The model is estimated from family-level expenditures on seven consumption categories, and a new set of regional cost-of-living indexes. The sources for expenditures are the national expenditure surveys conducted in 1986/87 and 1995/96, which collected data from 11 metropolitan areas. Corresponding price indexes were constructed from detailed commodity prices, also from each metropolitan area. The salient features of our study are: a) price variations come from both time and regional differences, which allows us to estimate price elasticities with high precision; b) we have large variations in income (total expenditures) which is rarely available in aggregated data; and c) we can control for time specific factors by exploiting the panel structure of the data set. Contrary to the rule of thumb in empirical studies of demand systems, the estimation results display consistency with demand theory, and elasticity estimates are close to economic common sense. The estimated system will serve as a microeconomic basis for evaluating various policy-related issues.

Keywords: Consumer demand System, Almost Ideal Demand System, Brazilian family expenditures.
JEL: C33, C81, D12.

Neste estudo, estimamos o sistema de demanda de consumo brasileiro através de dados de dispêndios das famílias, que cobrem todas as categorias de consumo, e de um novo conjunto de índices regionais de custo de vida. As fontes de dados de dispêndios são as duas Pesquisas de Orçamentos Familiares (POF) do IBGE, realizadas em 1986/87 e 1995/96, que coletaram dados das nove áreas metropolitanas, Distrito Federal e município de Goiânia, e que serviram de base para as atualizações do Sistema Nacional de Índices de Preços ao Consumidor. Os índices de preços correspondentes foram construídos a partir de preços detalhados de bens e serviços, tornados públicos pelo IBGE para cada uma das regiões pesquisadas. Até onde sabemos, este é o primeiro estudo desse gênero com base nas POFs. O trabalho destaca-se da literatura existente por: a) contar com variações de preços tanto ao longo do tempo como entre regiões, o que nos permite estimar elasticidades de preços com alta precisão; b) observar grandes variações na renda (dispêndio total), o que é raramente disponível em dados agregados; e c) poder usar controles para fatores específicos de tempo, explorando a estrutura de painel do banco de dados. Ao contrário do que costuma acontecer em estudos empíricos de sistemas de demanda, os resultados da estimação mostram consistência com a teoria da demanda, e as elasticidades estimadas são próximas ao esperado pelo senso econômico comum. O sistema estimado servirá como base microeconômica para avaliar várias questões relacionadas à política econômica.


Palavras-chaves: Sistema de demanda de consumo, Almost Ideal Demand System, dispêndios das famílias brasileiras.",https://portalantigo.ipea.gov.br/portal/images/stories/PDFs/TDs/ingles/dp_99.pdf,,https://portalantigo.ipea.gov.br/portal/index.php?option=com_content&view=article&id=24859
168,DP 0098 - Brazilian Agriculture in the 1990s: Impact of the Policy Reforms,Steven M. Helfand and Gervásio Castro de Rezende,"ipea, economia, governo, federal, brasil, desenvolvimento, instituto de pesquisa econômica aplicada, secretaria de assuntos estratégicos, sae, pesquisa",Ipea - Instituto de Pesquisa Econômica Aplicada,https://portalantigo.ipea.gov.br/portal/images/stories/PDFs/TDs/ingles/dp_98.pdf,,https://portalantigo.ipea.gov.br/portal/index.php?option=com_content&view=article&id=24861
